{
  "$schema": "./css21-requirements.schema.json",
  "schemaVersion": 1,
  "target": "https://www.w3.org/TR/2011/REC-CSS2-20110607/",
  "reviewComplete": true,
  "requirements": [
    {
      "id": "css21.ua.stylesheets",
      "url": "https://www.w3.org/TR/2011/REC-CSS2-20110607/conform.html#conformance",
      "title": "Retrieve applicable associated stylesheets and recover from retrieval failures",
      "media": [
        "screen",
        "print"
      ],
      "status": "untested",
      "tests": []
    },
    {
      "id": "css21.ua.alternate-sets",
      "url": "https://www.w3.org/TR/2011/REC-CSS2-20110607/conform.html#conformance",
      "title": "Allow the user to select alternate stylesheet sets",
      "media": [
        "screen",
        "print"
      ],
      "status": "untested",
      "tests": []
    },
    {
      "id": "css21.ua.author-disabled",
      "url": "https://www.w3.org/TR/2011/REC-CSS2-20110607/conform.html#conformance",
      "title": "Allow the user to disable author stylesheets",
      "media": [
        "screen",
        "print"
      ],
      "status": "untested",
      "tests": []
    },
    {
      "id": "css21.ua.user-stylesheet",
      "url": "https://www.w3.org/TR/2011/REC-CSS2-20110607/conform.html#conformance",
      "title": "Allow the user to specify a user stylesheet file",
      "media": [
        "screen",
        "print"
      ],
      "status": "untested",
      "tests": []
    },
    {
      "id": "css21.D",
      "url": "https://www.w3.org/TR/2011/REC-CSS2-20110607/sample.html#q22.0",
      "title": "Default style sheet for HTML 4",
      "media": [
        "screen",
        "print"
      ],
      "status": "untested",
      "tests": []
    },
    {
      "id": "css21.E",
      "url": "https://www.w3.org/TR/2011/REC-CSS2-20110607/zindex.html#q23.0",
      "title": "Elaborate description of Stacking Contexts",
      "media": [
        "screen",
        "print"
      ],
      "status": "untested",
      "tests": []
    },
    {
      "id": "css21.3.2",
      "url": "https://www.w3.org/TR/2011/REC-CSS2-20110607/conform.html#conformance",
      "title": "UA Conformance",
      "media": [
        "screen",
        "print"
      ],
      "status": "untested",
      "tests": []
    },
    {
      "id": "css21.3.3",
      "url": "https://www.w3.org/TR/2011/REC-CSS2-20110607/conform.html#errors",
      "title": "Error conditions",
      "media": [
        "screen",
        "print"
      ],
      "status": "untested",
      "tests": []
    },
    {
      "id": "css21.3.4",
      "url": "https://www.w3.org/TR/2011/REC-CSS2-20110607/conform.html#text-css",
      "title": "The text/css content type",
      "media": [
        "screen",
        "print"
      ],
      "status": "untested",
      "tests": []
    },
    {
      "id": "css21.4.1",
      "url": "https://www.w3.org/TR/2011/REC-CSS2-20110607/syndata.html#syntax",
      "title": "Syntax",
      "media": [
        "screen",
        "print"
      ],
      "status": "untested",
      "tests": []
    },
    {
      "id": "css21.4.1.1",
      "url": "https://www.w3.org/TR/2011/REC-CSS2-20110607/syndata.html#tokenization",
      "title": "Tokenization",
      "media": [
        "screen",
        "print"
      ],
      "status": "untested",
      "tests": []
    },
    {
      "id": "css21.4.1.2",
      "url": "https://www.w3.org/TR/2011/REC-CSS2-20110607/syndata.html#keywords",
      "title": "Keywords",
      "media": [
        "screen",
        "print"
      ],
      "status": "untested",
      "tests": []
    },
    {
      "id": "css21.4.1.2.1",
      "url": "https://www.w3.org/TR/2011/REC-CSS2-20110607/syndata.html#vendor-keywords",
      "title": "Vendor-specific extensions",
      "media": [
        "screen",
        "print"
      ],
      "status": "untested",
      "tests": []
    },
    {
      "id": "css21.4.1.3",
      "url": "https://www.w3.org/TR/2011/REC-CSS2-20110607/syndata.html#characters",
      "title": "Characters and case",
      "media": [
        "screen",
        "print"
      ],
      "status": "untested",
      "tests": []
    },
    {
      "id": "css21.4.1.4",
      "url": "https://www.w3.org/TR/2011/REC-CSS2-20110607/syndata.html#statements",
      "title": "Statements",
      "media": [
        "screen",
        "print"
      ],
      "status": "untested",
      "tests": []
    },
    {
      "id": "css21.4.1.5",
      "url": "https://www.w3.org/TR/2011/REC-CSS2-20110607/syndata.html#at-rules",
      "title": "At-rules",
      "media": [
        "screen",
        "print"
      ],
      "status": "untested",
      "tests": []
    },
    {
      "id": "css21.4.1.6",
      "url": "https://www.w3.org/TR/2011/REC-CSS2-20110607/syndata.html#block",
      "title": "Blocks",
      "media": [
        "screen",
        "print"
      ],
      "status": "untested",
      "tests": []
    },
    {
      "id": "css21.4.1.7",
      "url": "https://www.w3.org/TR/2011/REC-CSS2-20110607/syndata.html#rule-sets",
      "title": "Rule sets, declaration blocks, and selectors",
      "media": [
        "screen",
        "print"
      ],
      "status": "untested",
      "tests": []
    },
    {
      "id": "css21.4.1.8",
      "url": "https://www.w3.org/TR/2011/REC-CSS2-20110607/syndata.html#declaration",
      "title": "Declarations and properties",
      "media": [
        "screen",
        "print"
      ],
      "status": "untested",
      "tests": []
    },
    {
      "id": "css21.4.1.9",
      "url": "https://www.w3.org/TR/2011/REC-CSS2-20110607/syndata.html#comments",
      "title": "Comments",
      "media": [
        "screen",
        "print"
      ],
      "status": "untested",
      "tests": []
    },
    {
      "id": "css21.4.2",
      "url": "https://www.w3.org/TR/2011/REC-CSS2-20110607/syndata.html#parsing-errors",
      "title": "Rules for handling parsing errors",
      "media": [
        "screen",
        "print"
      ],
      "status": "untested",
      "tests": []
    },
    {
      "id": "css21.4.3",
      "url": "https://www.w3.org/TR/2011/REC-CSS2-20110607/syndata.html#values",
      "title": "Values",
      "media": [
        "screen",
        "print"
      ],
      "status": "untested",
      "tests": []
    },
    {
      "id": "css21.4.3.1",
      "url": "https://www.w3.org/TR/2011/REC-CSS2-20110607/syndata.html#numbers",
      "title": "Integers and real numbers",
      "media": [
        "screen",
        "print"
      ],
      "status": "untested",
      "tests": []
    },
    {
      "id": "css21.4.3.2",
      "url": "https://www.w3.org/TR/2011/REC-CSS2-20110607/syndata.html#length-units",
      "title": "Lengths",
      "media": [
        "screen",
        "print"
      ],
      "status": "untested",
      "tests": []
    },
    {
      "id": "css21.4.3.3",
      "url": "https://www.w3.org/TR/2011/REC-CSS2-20110607/syndata.html#percentage-units",
      "title": "Percentages",
      "media": [
        "screen",
        "print"
      ],
      "status": "untested",
      "tests": []
    },
    {
      "id": "css21.4.3.4",
      "url": "https://www.w3.org/TR/2011/REC-CSS2-20110607/syndata.html#uri",
      "title": "URLs and URIs",
      "media": [
        "screen",
        "print"
      ],
      "status": "untested",
      "tests": []
    },
    {
      "id": "css21.4.3.5",
      "url": "https://www.w3.org/TR/2011/REC-CSS2-20110607/syndata.html#counter",
      "title": "Counters",
      "media": [
        "screen",
        "print"
      ],
      "status": "untested",
      "tests": []
    },
    {
      "id": "css21.4.3.6",
      "url": "https://www.w3.org/TR/2011/REC-CSS2-20110607/syndata.html#color-units",
      "title": "Colors",
      "media": [
        "screen",
        "print"
      ],
      "status": "untested",
      "tests": []
    },
    {
      "id": "css21.4.3.7",
      "url": "https://www.w3.org/TR/2011/REC-CSS2-20110607/syndata.html#strings",
      "title": "Strings",
      "media": [
        "screen",
        "print"
      ],
      "status": "untested",
      "tests": []
    },
    {
      "id": "css21.4.3.8",
      "url": "https://www.w3.org/TR/2011/REC-CSS2-20110607/syndata.html#unsupported-values",
      "title": "Unsupported Values",
      "media": [
        "screen",
        "print"
      ],
      "status": "untested",
      "tests": []
    },
    {
      "id": "css21.4.4",
      "url": "https://www.w3.org/TR/2011/REC-CSS2-20110607/syndata.html#charset",
      "title": "CSS style sheet representation",
      "media": [
        "screen",
        "print"
      ],
      "status": "untested",
      "tests": []
    },
    {
      "id": "css21.4.4.1",
      "url": "https://www.w3.org/TR/2011/REC-CSS2-20110607/syndata.html#escaping",
      "title": "Referring to characters not represented in a character encoding",
      "media": [
        "screen",
        "print"
      ],
      "status": "untested",
      "tests": []
    },
    {
      "id": "css21.5.1",
      "url": "https://www.w3.org/TR/2011/REC-CSS2-20110607/selector.html#pattern-matching",
      "title": "Pattern matching",
      "media": [
        "screen",
        "print"
      ],
      "status": "untested",
      "tests": []
    },
    {
      "id": "css21.5.2",
      "url": "https://www.w3.org/TR/2011/REC-CSS2-20110607/selector.html#selector-syntax",
      "title": "Selector syntax",
      "media": [
        "screen",
        "print"
      ],
      "status": "untested",
      "tests": []
    },
    {
      "id": "css21.5.2.1",
      "url": "https://www.w3.org/TR/2011/REC-CSS2-20110607/selector.html#grouping",
      "title": "Grouping",
      "media": [
        "screen",
        "print"
      ],
      "status": "untested",
      "tests": []
    },
    {
      "id": "css21.5.3",
      "url": "https://www.w3.org/TR/2011/REC-CSS2-20110607/selector.html#universal-selector",
      "title": "Universal selector",
      "media": [
        "screen",
        "print"
      ],
      "status": "untested",
      "tests": []